<?xml version="1.0" encoding="UTF-8"?>
<migDataDictionary xmlns="http://faculty.washington.edu/tgis/xml/xsd"
    xmlns:xsi="http://www.w3.org/2001/XMLSchema-instance"
    xsi:schemaLocation="http://faculty.washington.edu/tgis/xml/xsd schema-4-dds.xsd">
    <ddName>University of Washington East Asia Library Digital Chinese Rubbings Collection</ddName>
    <ddPartOfProject/>
    <latestUpdate>October 11, 2016</latestUpdate>
    <metadataLiaisons>
        <metadataLiaison>Theodore Gerontakos, Ann Lally, Zhijia Shen</metadataLiaison>
    </metadataLiaisons>
    <cdmCo>no</cdmCo>
    <standalone>yes</standalone>
    <properties>
        <property>
            <cdmLabel>Title</cdmLabel>
            <cdm-dc-label>Title</cdm-dc-label>
            <dc>title</dc>
            <cdmDatatype>text</cdmDatatype>
            <cdmLarge>no</cdmLarge>
            <searchable>yes</searchable>
            <hidden>no</hidden>
            <required>yes</required>
            <cdmControlledVocab>no</cdmControlledVocab>
            <description>
                <para>Enter transcribed title or formulate a title. This title should be in English.</para>
            </description>
            <examples>
                <para>Scroll prints with Xu Zhang’s cursive calligraphy</para>
                <para>	Wuliang Shrine, North Wuzhaishan Village, Jiaxiang County, Jining City, Shandong Province, China</para>
            </examples>
            <descriptionCoObject/>
            <descriptionCoItem/>
        </property>
        <property>
            <cdmLabel>[Title-Chinese-Label undecided, see admin notes]</cdmLabel>
            <cdm-dc-label>Title-Alternative</cdm-dc-label>
            <dc>alternative</dc>
            <cdmDatatype>text</cdmDatatype>
            <cdmLarge>no</cdmLarge>
            <searchable>yes</searchable>
            <hidden>no</hidden>
            <required>yes</required>
            <cdmControlledVocab>no</cdmControlledVocab>
            <description>
                <para>Enter transcribed title or formulate a title. This title should be in Chinese.</para>
            </description>
            <examples>
                <para>張旭草書拓本</para>
                <para>韓寄生造像記</para>
            </examples>
            <descriptionCoObject/>
            <descriptionCoItem/>
            <admin>
                <para>Undecided on Chinese field label.</para>
                <para>學名</para>
                <para>題名</para>
            </admin>
        </property>
        <property>
            <cdmLabel>[Title-Romanized]</cdmLabel>
            <cdm-dc-label>Title-Alternative</cdm-dc-label>
            <dc>alternative</dc>
            <cdmDatatype>text</cdmDatatype>
            <cdmLarge>no</cdmLarge>
            <searchable>yes</searchable>
            <hidden>yes</hidden>
            <required>no</required>
            <cdmControlledVocab>no</cdmControlledVocab>
            <description>
                <para>Romanize Chinese title using the appropriate ALA-LC Romanization Table.</para>
            </description>
            <examples>
                <para>Han Chi-sheng tsao hsiang chi</para>
            </examples>
            <descriptionCoObject/>
            <descriptionCoItem/>
            <admin>
                <para>Not sure we want this field. If we do, where else do we want romanization?</para>
            </admin>
        </property>
        <property>
            <cdmLabel>Original Creator</cdmLabel>
            <cdm-dc-label>Creator</cdm-dc-label>
            <dc>creator</dc>
            <cdmDatatype>text</cdmDatatype>
            <cdmLarge>no</cdmLarge>
            <searchable>yes</searchable>
            <hidden>no</hidden>
            <required>no</required>
            <cdmControlledVocab>no</cdmControlledVocab>
            <description>
                <para>Enter name of the creator of the original.</para>
                <para>Enter the value in English.</para>
                <para>If there are multiple creators, separate each creator with a semi-colon + space.</para>
            </description>
            <examples>
                <para>Huai-su (725-85)</para>
            </examples>
            <descriptionCoObject/>
            <descriptionCoItem/>
            <admin>
                <para>Will the creator usually be an author? Maybe an artist? Should we have more than one field with custom labels for each type of creator?</para>
                <para>Other possibilities for "agents:" author/creator-or-contributor, calligrapher/creator-or-contributor, inscriber/creator-or-contributor, collector/contributor, rubbing maker/contributor</para>
            </admin>
        </property>
        <property>
            <cdmLabel>[Original Creator-Chinese]</cdmLabel>
            <cdm-dc-label>Creator</cdm-dc-label>
            <dc>creator</dc>
            <cdmDatatype>text</cdmDatatype>
            <cdmLarge>no</cdmLarge>
            <searchable>yes</searchable>
            <hidden>no</hidden>
            <required>no</required>
            <cdmControlledVocab>no</cdmControlledVocab>
            <description>
                <para>Enter name of the creator of the original.</para>
                <para>Enter the value in English.</para>
                <para>If there are multiple creators, separate each creator with a semi-colon + space.</para>
            </description>
            <examples>
                <para>懷素</para>
            </examples>
            <descriptionCoObject/>
            <descriptionCoItem/>
            <admin>
                <para>Undecided on Chinese field label.</para>
                <para>作者</para>
                <para>撰文㆟</para>
                <para>创造者</para>
            </admin>
        </property>
        <property>
            <cdmLabel>[Original Creator-romanized]</cdmLabel>
            <cdm-dc-label>Creator</cdm-dc-label>
            <dc>creator</dc>
            <cdmDatatype>text</cdmDatatype>
            <cdmLarge>no</cdmLarge>
            <searchable>yes</searchable>
            <hidden>yes</hidden>
            <required>no</required>
            <cdmControlledVocab>no</cdmControlledVocab>
            <description>
                <para>Romanize Chinese title using the appropriate ALA-LC Romanization Table.</para>
            </description>
            <descriptionCoObject/>
            <descriptionCoItem/>
            <admin>
                <para>Do we want this field? Is the name in "English" really a romanized version?</para>
            </admin>
        </property>
        <property>
            <cdmLabel>Date of Original</cdmLabel>
            <cdm-dc-label>Date-Created</cdm-dc-label>
            <dc>created</dc>
            <cdmDatatype>text</cdmDatatype>
            <cdmLarge>no</cdmLarge>
            <searchable>no</searchable>
            <hidden>no</hidden>
            <required>yes</required>
            <cdmControlledVocab>no</cdmControlledVocab>
            <description>
                <para>Enter date the original artifact was created (if known).</para>
                <para>	
                Enter date or date range for all items.</para>
                <para>This is the display field. Enter first the day if available, then the month</para>
            </description>
            <examples>
                <para>23 April 2001</para>
                <para>October-November 2006</para>
            </examples>
            <descriptionCoObject/>
            <descriptionCoItem/>
            <admin>
                <para>Required if creation date is unknown.</para>
                <para>Throughout the data dictionary, do we want to refer to the original artifact as "The original?"</para>
            </admin>
        </property>
        <property>
            <cdmLabel>[Date of Original with Chinese label]</cdmLabel>
            <cdm-dc-label>Date-Created</cdm-dc-label>
            <dc>created</dc>
            <cdmDatatype>text</cdmDatatype>
            <cdmLarge>no</cdmLarge>
            <searchable>no</searchable>
            <hidden>no</hidden>
            <required>yes</required>
            <cdmControlledVocab>no</cdmControlledVocab>
            <description>
                <para>Enter date the original artifact was created (if known).</para>
                <para>	
                Enter date or date range for all items.</para>
                <para>This is the display field. Enter first the day if available, then the month</para>
            </description>
            <examples>
                <para>23 April 2001</para>
                <para>October-November 2006</para>
            </examples>
            <descriptionCoObject/>
            <descriptionCoItem/>
            <admin>
                <para>Required if creation date is unknown.</para>
                <para>The value of this field is the same as "Date of original." The only difference between that field and this is the name of the field (i.e. the label). We could combine into one field with a bilingual label, if preferred.</para>
                <para>Not sure what the field name will be.</para>
                <para>年代</para>
                <para>Please note only date types following the Gregorian Calendar are expected in our date fields; we have no date fields that expect dates using other systems.</para>
            </admin>
        </property>
        <property>
            <cdmLabel>DatesOfOriginal</cdmLabel>
            <cdm-dc-label>None</cdm-dc-label>
            <dc>none</dc>
            <cdmDatatype>text</cdmDatatype>
            <cdmLarge>no</cdmLarge>
            <searchable>yes</searchable>
            <hidden>yes</hidden>
            <required>yes</required>
            <cdmControlledVocab>no</cdmControlledVocab>
            <description>
                <para>Enter year only.</para>
                <para>Separate additional years, even if sequential, with comma.</para>
                <para>Approximate dates should include five years on either side.</para>